Symbol,Name,Last Sale,Net Change,% Change,Market Cap,Country,IPO Year,Volume,Sector,Industry
NVRO,Nevro Corp. Common Stock,$175.80,-0.64,-0.363%,6052578118.00,United States,2014,239075,Health Care,Medical/Dental Instruments
NVS,Novartis AG Common Stock,$89.39,-0.70,-0.777%,201737322871.00,Switzerland,,1788970,Health Care,Major Pharmaceuticals
NVST,Envista Holdings Corporation Common Stock,$37.71,-0.41,-1.076%,6033600000.00,,2019,1494004,Health Care,Medical/Dental Instruments
NVTA,Invitae Corporation Common Stock,$47.52,-0.34,-0.71%,9058820000.00,United States,2015,5293256,Health Care,Medical Specialities
NXTC,NextCure Inc. Common Stock,$13.05,-0.34,-2.539%,359567811.00,United States,2019,297358,Health Care,Major Pharmaceuticals
NYMX,Nymox Pharmaceutical Corporation Common Stock (Bahamas),$3.19,-0.04,-1.238%,246303572.00,Canada,,124663,Health Care,Biotechnology: In Vitro & In Vivo Diagnostic Substances
OBLN,Obalon Therapeutics Inc. Common Stock,$4.32,0.18,4.348%,33569415.00,United States,2016,776824,Health Care,Medical/Dental Instruments
OBSV,ObsEva SA Ordinary Shares,$3.97,0.14,3.655%,255833755.00,Switzerland,2017,10564044,Health Care,Major Pharmaceuticals
OCDX,Ortho Clinical Diagnostics plc Ordinary Shares,$16.98,-0.40,-2.301%,3973057931.00,United States,2021,931440,Health Care,Biotechnology: In Vitro & In Vivo Diagnostic Substances
OCGN,Ocugen Inc. Common Stock,$10.17,-0.06,-0.587%,1902272821.00,United States,2014,19346628,Health Care,Biotechnology: Biological Products (No Diagnostic Substances)
OCUL,Ocular Therapeutix Inc. Common Stock,$19.52,1.21,6.608%,1469903180.00,United States,2014,1209448,Health Care,Major Pharmaceuticals
OCUP,Ocuphire Pharma Inc. Common Stock,$11.58,-0.37,-3.096%,125548855.00,United States,,142707,Health Care,Major Pharmaceuticals
OCX,OncoCyte Corporation Common Stock,$6.19,-0.18,-2.826%,542298534.00,United States,2015,915370,Health Care,Biotechnology: In Vitro & In Vivo Diagnostic Substances
ODT,Odonate Therapeutics Inc. Common Stock,$23.16,-1.35,-5.508%,892623734.00,United States,2017,200144,Health Care,Major Pharmaceuticals
OFIX,Orthofix Medical Inc. Common Stock (DE),$42.00,-0.50,-1.176%,812015316.00,Curacao,1992,45704,Health Care,Medical/Dental Instruments
OGEN,Oragenics Inc. Common Stock,$1.20,-0.09,-6.977%,131128255.00,United States,,7367362,Health Care,Major Pharmaceuticals
OGI,Organigram Holdings Inc. Common Shares,$3.41,-0.32,-8.579%,791670677.00,Canada,,19874831,Health Care,Major Pharmaceuticals
OLMA,Olema Pharmaceuticals Inc. Common Stock,$50.10,-0.88,-1.726%,2012503874.00,United States,2020,114512,Health Care,Major Pharmaceuticals
OM,Outset Medical Inc. Common Stock,$51.34,-1.86,-3.496%,2192249369.00,United States,2020,109713,Health Care,Biotechnology: Electromedical & Electrotherapeutic Apparatus
OMER,Omeros Corporation Common Stock,$22.02,-0.20,-0.90%,1357584219.00,United States,2009,403752,Health Care,Major Pharmaceuticals
OMI,Owens & Minor Inc. Common Stock,$26.20,-1.06,-3.888%,1926021710.00,United States,,1168880,Health Care,Medical Specialities
ONCR,Oncorus Inc. Common Stock,$16.19,-0.65,-3.86%,366184416.00,United States,2020,281162,Health Care,Major Pharmaceuticals
ONCS,OncoSec Medical Incorporated Common Stock,$6.77,-0.21,-3.009%,241706318.00,United States,,186343,Health Care,Major Pharmaceuticals
ONCT,Oncternal Therapeutics Inc. Common Stock,$7.53,-0.78,-9.386%,367211730.00,United States,,1163741,Health Care,Major Pharmaceuticals
ONCY,Oncolytics Biotech Inc. Common Shares,$3.50,-0.06,-1.685%,145799493.00,Canada,,4087646,Health Care,Major Pharmaceuticals
ONEM,1Life Healthcare Inc. Common Stock,$55.04,-0.21,-0.38%,7321016696.00,United States,2020,687391,Health Care,Medical/Nursing Services
ONTX,Onconova Therapeutics Inc. Common Stock,$1.76,0.25,16.556%,409661808.00,United States,2013,239931905,Health Care,Major Pharmaceuticals
ONTXW,Onconova Therapeutics Inc. Warrants,$0.4749,0.0704,17.404%,0.00,United States,,656296,Health Care,Major Pharmaceuticals
ONVO,Organovo Holdings Inc. Common Stock,$14.47,-2.59,-15.182%,102984191.00,United States,,707171,Health Care,Biotechnology: Biological Products (No Diagnostic Substances)
OPCH,Option Care Health Inc. Common Stock,$19.01,-0.85,-4.28%,3417895099.00,United States,,809126,Health Care,Medical/Nursing Services
OPGN,OpGen Inc. Common Stock,$2.93,-0.06,-2.007%,65890775.00,United States,2015,1925615,Health Care,Medical Specialities
OPK,OPKO Health Inc. Common Stock,$5.36,-0.21,-3.77%,3591200129.00,United States,,7081903,Health Care,Major Pharmaceuticals
OPNT,Opiant Pharmaceuticals Inc. Common Stock,$14.00,0.11,0.792%,59613470.00,United States,,75548,Health Care,Major Pharmaceuticals
OPTN,OptiNose Inc. Common Stock,$4.30,0.08,1.896%,223946374.00,United States,2017,539676,Health Care,Major Pharmaceuticals
ORGO,Organogenesis Holdings Inc. Class A Common Stock,$13.20,-0.18,-1.345%,1685669489.00,United States,2016,601858,Health Care,Major Pharmaceuticals
ORGS,Orgenesis Inc. Common Stock,$7.09,0.07,0.997%,156649792.00,United States,,237096,Health Care,Major Pharmaceuticals
ORIC,Oric Pharmaceuticals Inc. Common Stock,$34.30,0.52,1.539%,1220839420.00,United States,2020,158233,Health Care,Major Pharmaceuticals
ORMP,Oramed Pharmaceuticals Inc. Common Stock,$10.50,-0.83,-7.326%,308389253.00,Israel,,461661,Health Care,Major Pharmaceuticals
ORPH,Orphazyme A/S American Depositary Shares,$12.95,-0.05,-0.385%,451538450.00,Denmark,2020,9146,Health Care,Major Pharmaceuticals
ORTX,Orchard Therapeutics plc American Depositary Shares,$7.50,-0.19,-2.471%,913988993.00,United Kingdom,2018,1287083,Health Care,Biotechnology: Biological Products (No Diagnostic Substances)
OSH,Oak Street Health Inc. Common Stock,$59.65,-1.56,-2.549%,14365432790.00,United States,2020,1013220,Health Care,Medical/Nursing Services
OSMT,Osmotica Pharmaceuticals plc Ordinary Shares,$4.32,-0.11,-2.483%,270370794.00,United States,2018,271059,Health Care,Major Pharmaceuticals
OSUR,OraSure Technologies Inc. Common Stock,$12.83,-0.33,-2.508%,920331208.00,United States,,637169,Health Care,Medical/Dental Instruments
OTIC,Otonomy Inc. Common Stock,$5.35,-0.28,-4.973%,258506490.00,United States,2014,864917,Health Care,Major Pharmaceuticals
OTLK,Outlook Therapeutics Inc. Common Stock,$2.33,-0.19,-7.54%,395611872.00,United States,2016,2241546,Health Care,Biotechnology: Biological Products (No Diagnostic Substances)
OTLKW,Outlook Therapeutics Inc. Series A Warrant Expiring 02/18/2022,$1.1105,-0.0989,-8.178%,0.00,United States,2016,66433,Health Care,Biotechnology: Biological Products (No Diagnostic Substances)
OTRK,Ontrak Inc. Common Stock,$72.40,-2.26,-3.027%,1260896752.00,United States,,281062,Health Care,Misc Health and Biotechnology Services
OTRKP,Ontrak Inc. 9.50% Series A Cumulative Perpetual Preferred Stock,$24.93,-0.06,-0.24%,0.00,United States,,16807,Health Care,Misc Health and Biotechnology Services
OVID,Ovid Therapeutics Inc. Common Stock,$3.43,-0.29,-7.796%,217582811.00,United States,2017,2116580,Health Care,Major Pharmaceuticals
OXFD,Oxford Immunotec Global PLC Ordinary Shares,$21.95,0.00,0.00%,561433456.00,United Kingdom,2013,120807,Health Care,Biotechnology: In Vitro & In Vivo Diagnostic Substances
OYST,Oyster Point Pharma Inc. Common Stock,$25.59,-0.27,-1.044%,661968876.00,United States,2019,252903,Health Care,Biotechnology: Biological Products (No Diagnostic Substances)
PAHC,Phibro Animal Health Corporation Class A Common Stock,$23.04,-0.25,-1.073%,932051128.00,United States,2014,186494,Health Care,Major Pharmaceuticals
PAND,Pandion Therapeutics Inc. Common Stock,$21.68,-0.33,-1.499%,639991475.00,United States,2020,86216,Health Care,Major Pharmaceuticals
PASG,Passage Bio Inc. Common Stock,$21.46,-0.81,-3.637%,1135600623.00,United States,2020,188961,Health Care,Biotechnology: Biological Products (No Diagnostic Substances)
PAVM,PAVmed Inc. Common Stock,$4.71,-0.34,-6.733%,338669107.00,United States,2016,5534385,Health Care,Medical/Dental Instruments
PAVMW,PAVmed Inc. Warrant,$1.51,0.01,0.667%,0.00,United States,2016,61689,Health Care,Medical/Dental Instruments
PAVMZ,PAVmed Inc. Series Z Warrant,$3.13,-0.17,-5.152%,0.00,United States,,117690,Health Care,Medical/Dental Instruments
PBH,Prestige Consumer Healthcare Inc. Common Stock,$42.13,-0.30,-0.707%,2100802002.00,United States,2005,489331,Health Care,Major Pharmaceuticals
PBLA,Panbela Therapeutics Inc. Common Stock,$5.27,0.26,5.19%,50852480.00,United States,,393030,Health Care,Major Pharmaceuticals
PBYI,Puma Biotechnology Inc Common Stock,$11.51,-0.51,-4.243%,457665581.00,United States,,257873,Health Care,Major Pharmaceuticals
PCRX,Pacira BioSciences Inc. Common Stock,$74.41,0.17,0.229%,3232645643.00,United States,2011,557001,Health Care,Major Pharmaceuticals
PCSA,Processa Pharmaceuticals Inc. Common Stock,$10.50,-0.26,-2.416%,110938443.00,United States,,385100,Health Care,Major Pharmaceuticals
PCVX,Vaxcyte Inc. Common Stock,$25.19,-1.18,-4.475%,1283423220.00,United States,2020,445319,Health Care,Biotechnology: Biological Products (No Diagnostic Substances)
PDCO,Patterson Companies Inc. Common Stock,$31.02,-0.38,-1.21%,2993554080.00,United States,1992,564799,Health Care,Medical Specialities
PDEX,Pro-Dex Inc. Common Stock,$26.89,0.75,2.869%,103812583.00,United States,,51827,Health Care,Medical/Dental Instruments
PDSB,PDS Biotechnology Corporation Common Stock,$4.85,-0.34,-6.551%,107968852.00,United States,2015,537044,Health Care,Major Pharmaceuticals
PEN,Penumbra Inc. Common Stock,$277.61,2.09,0.759%,10080363059.00,,2015,397586,Health Care,Medical/Dental Instruments
PETQ,PetIQ Inc. Class A Common Stock,$34.24,-1.00,-2.838%,982572954.00,United States,2017,281733,Health Care,Other Pharmaceuticals
PETS,PetMed Express Inc. Common Stock,$35.84,-1.24,-3.344%,726517012.00,United States,,432415,Health Care,Medical/Nursing Services
PFE,Pfizer Inc. Common Stock,$34.56,-0.33,-0.946%,192098186461.00,United States,,23817275,Health Care,Major Pharmaceuticals
PGEN,Precigen Inc. Common Stock,$7.80,-0.17,-2.133%,1598257557.00,United States,,875482,Health Care,Major Pharmaceuticals
PGNY,Progyny Inc. Common Stock,$49.03,-0.36,-0.729%,4247647712.00,United States,2019,412076,Health Care,Misc Health and Biotechnology Services
PHAR,Pharming Group N.V. ADS each representing 10 ordinary shares,$13.82,-0.38,-2.676%,881792853.00,Netherlands,,3426,Health Care,Major Pharmaceuticals
PHAS,PhaseBio Pharmaceuticals Inc. Common Stock,$4.35,-0.37,-7.839%,127736984.00,United States,2018,230564,Health Care,Major Pharmaceuticals
PHAT,Phathom Pharmaceuticals Inc. Common Stock,$45.12,0.61,1.37%,1270854116.00,United States,2019,154702,Health Care,Major Pharmaceuticals
PHG,Koninklijke Philips N.V. NY Registry Shares,$56.84,-0.44,-0.768%,51447475520.00,Netherlands,,297971,Health Care,Medical Electronics
PHGE,BiomX Inc. COmmon Stock,$8.07,0.64,8.614%,187603710.00,,2019,153836,Health Care,Biotechnology: Biological Products (No Diagnostic Substances)
PHIO,Phio Pharmaceuticals Corp. Common Stock,$4.05,0.07,1.759%,41317436.00,United States,,4631041,Health Care,Major Pharmaceuticals
PHIOW,Phio Pharmaceuticals Corp. Warrants expiring 12/21/2021,$0.67,-0.09,-11.842%,0.00,United States,,94767,Health Care,Major Pharmaceuticals
PHVS,Pharvaris N.V. Ordinary Shares,$30.74,4.22,15.913%,978754714.00,Netherlands,2021,170879,Health Care,Major Pharmaceuticals
PIRS,Pieris Pharmaceuticals Inc. Common Stock,$2.87,-0.18,-5.902%,160635565.00,Germany,,485947,Health Care,Major Pharmaceuticals
PLRX,Pliant Therapeutics Inc. Common Stock,$30.37,-1.60,-5.005%,1077523136.00,United States,2020,85890,Health Care,Major Pharmaceuticals
PLSE,Pulse Biosciences Inc Common Stock (DE),$34.75,-0.15,-0.43%,905653631.00,United States,2016,117744,Health Care,Medical/Dental Instruments
PLX,Protalix BioTherapeutics Inc. (DE) Common Stock,$4.82,0.08,1.688%,176570250.00,Israel,,3523386,Health Care,Biotechnology: Biological Products (No Diagnostic Substances)
PLXP,PLx Pharma Inc. Common Stock,$8.10,-0.46,-5.374%,112684227.00,United States,2014,81559,Health Care,Major Pharmaceuticals
PMD,Psychemedics Corporation,$7.38,-0.22,-2.895%,40785518.00,United States,,17140,Health Care,Medical Specialities
PMVP,PMV Pharmaceuticals Inc. Common Stock,$40.65,4.34,11.953%,1820052856.00,United States,2020,123976,Health Care,Major Pharmaceuticals
PNTG,The Pennant Group Inc. Common Stock ,$56.37,-0.17,-0.301%,1589043186.00,United States,,77547,Health Care,Medical/Nursing Services
POAI,Predictive Oncology Inc. Common Stock,$1.93,-0.27,-12.273%,29762542.00,United States,,12462271,Health Care,Industrial Specialties
PODD,Insulet Corporation Common Stock,$273.31,-6.38,-2.281%,18018746423.00,United States,2007,305015,Health Care,Medical/Dental Instruments
PPBT,Purple Biotech Ltd. American Depositary Shares,$6.16,0.57,10.197%,107865136.00,Israel,2015,1620979,Health Care,Major Pharmaceuticals
PPD,PPD Inc. Common Stock,$36.54,-0.36,-0.976%,12776373566.00,United States,2020,920303,Health Care,Biotechnology: Commercial Physical & Biological Resarch
PRAH,PRA Health Sciences Inc. Common Stock,$125.42,-1.48,-1.166%,8045646093.00,United States,2014,292293,Health Care,Biotechnology: Commercial Physical & Biological Resarch
PRAX,Praxis Precision Medicines Inc. Common Stock,$52.02,0.94,1.84%,1990383674.00,United States,2020,61139,Health Care,Major Pharmaceuticals
PRFX,PainReform Ltd. Ordinary Shares,$5.82,-0.56,-8.777%,50971653.00,Israel,2020,233256,Health Care,Major Pharmaceuticals
PRGO,Perrigo Company plc Ordinary Shares,$42.28,-1.77,-4.018%,5770852460.00,United States,,1790909,Health Care,Major Pharmaceuticals
PRLD,Prelude Therapeutics Incorporated Common Stock,$76.27,-8.09,-9.59%,3552533119.00,United States,2020,82034,Health Care,Major Pharmaceuticals
PROF,Profound Medical Corp. Common Stock,$25.00,-0.34,-1.342%,490648850.00,Canada,,66221,Health Care,Medical/Dental Instruments
PROG,Progenity Inc. Common Stock,$5.34,-0.36,-6.316%,291809261.00,United States,2020,381040,Health Care,Medical Specialities
PRPH,ProPhase Labs Inc. Common Stock (DE),$10.09,-0.02,-0.198%,152906413.00,United States,,235346,Health Care,Major Pharmaceuticals
PRQR,ProQR Therapeutics N.V. Ordinary Shares,$4.76,-0.29,-5.743%,238695931.00,Netherlands,2014,370489,Health Care,Major Pharmaceuticals
PRTA,Prothena Corporation plc Ordinary Shares,$23.75,-0.25,-1.042%,948133559.00,United States,,841853,Health Care,Major Pharmaceuticals
PRTC,PureTech Health plc American Depositary Shares,$58.00,0.00,0.00%,1658212692.00,United Kingdom,,46,Health Care,Major Pharmaceuticals
PRTK,Paratek Pharmaceuticals Inc. Common Stock,$7.61,-0.18,-2.311%,347329578.00,United States,,354154,Health Care,Major Pharmaceuticals
PRVB,Provention Bio Inc. Common Stock,$14.36,-0.15,-1.034%,900916115.00,United States,2018,443041,Health Care,Major Pharmaceuticals
PSNL,Personalis Inc. Common Stock,$38.60,-1.23,-3.088%,1502806273.00,United States,2019,766026,Health Care,Medical Specialities
PSTI,Pluristem Therapeutics Inc. Common Stock,$7.21,-0.35,-4.63%,227326015.00,Israel,,823258,Health Care,Biotechnology: Biological Products (No Diagnostic Substances)
PSTV,PLUS THERAPEUTICS Inc. Common Stock ,$3.39,0.07,2.108%,16202790.00,United States,,433044,Health Care,Medical/Dental Instruments
PSTX,Poseida Therapeutics Inc. Common Stock,$10.40,-0.22,-2.072%,642928104.00,United States,2020,288215,Health Care,Biotechnology: Biological Products (No Diagnostic Substances)
PTCT,PTC Therapeutics Inc. Common Stock,$58.84,-0.64,-1.076%,4014990883.00,United States,2013,378055,Health Care,Major Pharmaceuticals
PTE,PolarityTE Inc. Common Stock,$1.59,-0.11,-6.471%,106216487.00,United States,,6382683,Health Care,Biotechnology: Biological Products (No Diagnostic Substances)
PTGX,Protagonist Therapeutics Inc. Common Stock,$25.75,0.30,1.179%,1107731422.00,United States,2016,638991,Health Care,Major Pharmaceuticals
PTN,Palatin Technologies Inc. Common Stock,$0.9069,-0.0105,-1.145%,208497495.00,United States,,9537072,Health Care,Major Pharmaceuticals
PTPI,Petros Pharmaceuticals Inc. Common Stock,$3.84,-0.39,-9.22%,37510360.00,United States,,62410,Health Care,Major Pharmaceuticals
PULM,Pulmatrix Inc. Common Stock,$1.74,-0.17,-8.901%,59869020.00,United States,2014,7466623,Health Care,Major Pharmaceuticals
PYPD,PolyPid Ltd. Ordinary Shares,$13.58,-0.74,-5.168%,251158556.00,Israel,2020,85899,Health Care,Medical/Dental Instruments
QDEL,Quidel Corporation Common Stock,$210.10,-7.69,-3.531%,8838412425.00,United States,,744386,Health Care,Biotechnology: In Vitro & In Vivo Diagnostic Substances
QGEN,Qiagen N.V. Common Shares ,$55.67,0.52,0.943%,12691924950.00,Netherlands,,870870,Health Care,Biotechnology: Biological Products (No Diagnostic Substances)
QLGN,Qualigen Therapeutics Inc. Common Stock,$4.00,-0.07,-1.72%,106828196.00,United States,2015,1340414,Health Care,Major Pharmaceuticals
QLI,Qilian International Holding Group Ltd. Ordinary Shares,$7.00,-0.40,-5.405%,250250000.00,China,2021,315052,Health Care,Major Pharmaceuticals
QTNT,Quotient Limited Ordinary Shares,$5.20,-0.16,-2.985%,525892916.00,Switzerland,2014,455071,Health Care,Biotechnology: In Vitro & In Vivo Diagnostic Substances
QURE,uniQure N.V. Ordinary Shares,$34.70,-0.30,-0.857%,1544016093.00,Netherlands,2014,560609,Health Care,Major Pharmaceuticals
RAD,Rite Aid Corporation Common Stock,$21.89,-1.01,-4.41%,1208861306.00,United States,,2044835,Health Care,Medical/Nursing Services
RAPT,RAPT Therapeutics Inc. Common Stock,$19.80,-0.69,-3.367%,486194128.00,United States,2019,172359,Health Care,Major Pharmaceuticals
RARE,Ultragenyx Pharmaceutical Inc. Common Stock,$143.00,-0.11,-0.077%,9573741892.00,United States,2014,421633,Health Care,Major Pharmaceuticals
RCEL,Avita Therapeutics Inc. Common Stock,$24.98,-0.37,-1.46%,540149709.00,Australia,,123588,Health Care,Medical/Dental Instruments
RCKT,Rocket Pharmaceuticals Inc. Common Stock,$53.72,1.10,2.09%,3253986072.00,United States,2015,435144,Health Care,Major Pharmaceuticals
RCUS,Arcus Biosciences Inc. Common Stock,$31.94,-1.27,-3.824%,2073650330.00,,2018,652824,Health Care,Major Pharmaceuticals
RDHL,Redhill Biopharma Ltd. American Depositary Shares,$10.30,-0.54,-4.982%,428345297.00,Israel,,513750,Health Care,Major Pharmaceuticals
RDNT,RadNet Inc. Common Stock,$17.73,-0.99,-5.288%,915508035.00,United States,,154795,Health Care,Medical Specialities
RDUS,Radius Health Inc. Common Stock,$18.42,-0.78,-4.063%,857402869.00,United States,2014,258817,Health Care,Major Pharmaceuticals
RDY,Dr. Reddy's Laboratories Ltd Common Stock,$62.72,0.07,0.112%,10407544305.00,India,,389243,Health Care,Major Pharmaceuticals
REGN,Regeneron Pharmaceuticals Inc. Common Stock,$477.03,-4.65,-0.965%,51105129780.00,United States,1991,1121389,Health Care,Major Pharmaceuticals
REPH,Recro Pharma Inc. Common Stock,$4.25,-0.17,-3.846%,100489682.00,United States,2014,387882,Health Care,Major Pharmaceuticals
REPL,Replimune Group Inc. Common Stock,$36.27,-0.22,-0.603%,1686318048.00,United States,2018,273312,Health Care,Biotechnology: Biological Products (No Diagnostic Substances)
RETA,Reata Pharmaceuticals Inc. Class A Common Stock,$120.83,-8.57,-6.623%,4363866193.00,United States,2016,383409,Health Care,Major Pharmaceuticals
RGEN,Repligen Corporation Common Stock,$215.62,0.59,0.274%,11798135817.00,United States,1986,295792,Health Care,Biotechnology: Biological Products (No Diagnostic Substances)
RGLS,Regulus Therapeutics Inc. Common Stock,$1.80,-0.01,-0.552%,120421732.00,United States,2012,2076258,Health Care,Major Pharmaceuticals
RGNX,REGENXBIO Inc. Common Stock,$42.28,-2.44,-5.456%,1788758901.00,United States,2015,334588,Health Care,Biotechnology: Biological Products (No Diagnostic Substances)
RIGL,Rigel Pharmaceuticals Inc. Common Stock,$4.76,0.23,5.077%,804351626.00,United States,2000,22941105,Health Care,Major Pharmaceuticals
RLAY,Relay Therapeutics Inc. Common Stock,$43.16,-1.06,-2.397%,3883742889.00,United States,2020,438136,Health Care,Biotechnology: Biological Products (No Diagnostic Substances)
RLMD,Relmada Therapeutics Inc. Common Stock,$35.15,-1.35,-3.699%,570889639.00,United States,,62558,Health Care,Major Pharmaceuticals
RMD,ResMed Inc. Common Stock,$199.88,0.15,0.075%,29084355710.00,United States,,612874,Health Care,Medical/Dental Instruments
RMED,Ra Medical Systems Inc. Common Stock,$8.61,-0.36,-4.013%,27754955.00,,2018,386635,Health Care,Medical/Dental Instruments
RMTI,Rockwell Medical Inc. (DE) Common Stock,$1.61,-0.05,-3.012%,150652796.00,United States,1998,2033322,Health Care,Major Pharmaceuticals
RNA,Avidity Biosciences Inc. Common Stock,$22.24,-0.15,-0.67%,834592273.00,United States,2020,275283,Health Care,Major Pharmaceuticals
RNLX,Renalytix AI plc American Depositary Shares,$24.71,-0.59,-2.332%,889926128.00,United Kingdom,2020,20763,Health Care,Medical Specialities
RPRX,Royalty Pharma plc Class A Ordinary Shares ,$46.49,-0.72,-1.525%,29067426196.00,United States,2020,2829218,Health Care,Major Pharmaceuticals
RPTX,Repare Therapeutics Inc. Common Shares,$31.99,-0.96,-2.914%,1176112766.00,Canada,2020,200721,Health Care,Major Pharmaceuticals
RUBY,Rubius Therapeutics Inc. Common Stock,$11.87,-0.39,-3.181%,960567227.00,United States,2018,319422,Health Care,Biotechnology: Biological Products (No Diagnostic Substances)
RVMD,Revolution Medicines Inc. Common Stock,$44.54,-2.37,-5.052%,3253506966.00,United States,2020,364915,Health Care,Biotechnology: Biological Products (No Diagnostic Substances)
RVNC,Revance Therapeutics Inc. Common Stock,$28.19,-0.75,-2.592%,1876021215.00,United States,2014,372361,Health Care,Major Pharmaceuticals
RVP,Retractable Technologies Inc. Common Stock,$17.93,-1.61,-8.24%,606331710.00,United States,,980091,Health Care,Medical/Dental Instruments
RVPH,Reviva Pharmaceuticals Holdings Inc. Common Stock ,$8.40,-0.40,-4.545%,43130245.00,United States,2020,20177,Health Care,Major Pharmaceuticals
RVPHW,Reviva Pharmaceuticals Holdings Inc. Warrants,$0.675,-0.0351,-4.943%,0.00,United States,2018,38237,Health Care,Major Pharmaceuticals
RWLK,ReWalk Robotics Ltd. Ordinary Shares,$3.60,-1.10,-23.404%,89126010.00,Israel,2014,5385231,Health Care,Industrial Specialties
RYTM,Rhythm Pharmaceuticals Inc. Common Stock,$27.77,-0.96,-3.341%,1367281026.00,United States,2017,620110,Health Care,Major Pharmaceuticals
RZLT,Rezolute Inc. Common Stock,$12.40,0.425,3.549%,103568235.00,United States,,4211,Health Care,Major Pharmaceuticals
SAGE,Sage Therapeutics Inc. Common Stock,$78.47,-4.01,-4.862%,4573713092.00,United States,2014,579072,Health Care,Major Pharmaceuticals
SANA,Sana Biotechnology Inc. Common Stock,$35.20,0.20,0.571%,6594360115.00,United States,2021,397058,Health Care,Biotechnology: Biological Products (No Diagnostic Substances)
SAVA,Cassava Sciences Inc. Common Stock,$51.00,-0.22,-0.43%,1990800606.00,United States,,2811668,Health Care,Major Pharmaceuticals
SBBP,Strongbridge Biopharma plc Ordinary Shares,$3.49,-0.26,-6.933%,234680764.00,United States,2015,996188,Health Care,Major Pharmaceuticals
SBTX,Silverback Therapeutics Inc. Common Stock,$48.40,-3.36,-6.491%,1683918716.00,United States,2020,232855,Health Care,Major Pharmaceuticals
SCPH,scPharmaceuticals Inc. Common Stock,$7.39,-0.11,-1.467%,201894497.00,United States,2017,200247,Health Care,Major Pharmaceuticals
SCPS,Scopus BioPharma Inc. Common Stock,$10.15,0.25,2.525%,147962610.00,United States,2020,172681,Health Care,Major Pharmaceuticals
SCYX,SCYNEXIS Inc. Common Stock,$8.50,-0.85,-9.091%,163881012.00,United States,2014,796391,Health Care,Major Pharmaceuticals
SDC,SmileDirectClub Inc. Class A Common Stock,$11.88,-0.33,-2.703%,4586382215.00,United States,2019,3101355,Health Care,Medical/Dental Instruments
SDGR,Schrodinger Inc. Common Stock,$101.09,-3.91,-3.724%,7024453062.00,United States,2020,1244018,Health Care,Major Pharmaceuticals
SEEL,Seelos Therapeutics Inc. Common Stock,$3.53,-0.32,-8.312%,254394318.00,United States,,3349521,Health Care,Major Pharmaceuticals
SELB,Selecta Biosciences Inc. Common Stock,$4.76,-0.22,-4.418%,514224280.00,United States,2016,1553161,Health Care,Major Pharmaceuticals
SEM,Select Medical Holdings Corporation Common Stock,$26.99,-0.40,-1.46%,3637250401.00,United States,2009,399171,Health Care,Hospital/Nursing Management
SESN,Sesen Bio Inc. Common Stock,$3.01,-0.18,-5.643%,389312247.00,United States,2014,11398499,Health Care,Major Pharmaceuticals
SGEN,Seagen Inc. Common Stock,$158.62,-0.21,-0.132%,28736304425.00,United States,2001,825605,Health Care,Biotechnology: Biological Products (No Diagnostic Substances)
SGFY,Signify Health Inc. Class A Common Stock,$37.01,-1.09,-2.861%,8202410200.00,,2021,630715,Health Care,Medical/Nursing Services
SGMO,Sangamo Therapeutics Inc. Common Stock,$13.42,-0.03,-0.223%,1898143293.00,United States,2000,1243353,Health Care,Biotechnology: Biological Products (No Diagnostic Substances)
SGRY,Surgery Partners Inc. Common Stock,$36.95,-0.41,-1.097%,2194708287.00,United States,2015,327771,Health Care,Hospital/Nursing Management
SGTX,Sigilon Therapeutics Inc. Common Stock,$37.28,-3.63,-8.873%,1164637303.00,United States,2020,137016,Health Care,Major Pharmaceuticals
SHC,Sotera Health Company Common Stock,$28.06,0.34,1.227%,7784735045.00,United States,2020,444933,Health Care,Misc Health and Biotechnology Services
SIBN,SI-BONE Inc. Common Stock,$30.63,-0.72,-2.297%,991212499.00,United States,2018,221644,Health Care,Medical/Dental Instruments
SIEN,Sientra Inc. Common Stock,$8.23,0.17,2.109%,459766893.00,United States,2014,748038,Health Care,Industrial Specialties
SIGA,SIGA Technologies Inc. Common Stock,$6.37,-0.09,-1.393%,493034847.00,United States,,237497,Health Care,Major Pharmaceuticals
SILK,Silk Road Medical Inc. Common Stock,$55.77,-1.14,-2.003%,1893890307.00,United States,2019,223925,Health Care,Medical/Dental Instruments
